{
  "schema": "rsscript.eval.candidate.v1",
  "task_id": "option-defaults-chain",
  "source": "option-defaults-chain/candidate.rss",
  "mode": "language_card",
  "model": "sonnet",
  "model_version": "unknown",
  "temperature": null,
  "attempt": 1,
  "generation_duration_ms": 30189,
  "repair_turns": 0
}
