{
  "schema": "rsscript.eval.candidate.v1",
  "task_id": "map-default-aggregate",
  "source": "map-default-aggregate/candidate.rss",
  "mode": "prompt_only",
  "model": "sonnet",
  "model_version": "unknown",
  "temperature": null,
  "attempt": 1,
  "generation_duration_ms": 11232,
  "repair_turns": 0
}
