{
  "schema": "rsscript.eval.candidate.v1",
  "task_id": "firmware-retry-attempts",
  "source": "firmware-retry-attempts/candidate.rss",
  "mode": "prompt_only",
  "model": "sonnet",
  "model_version": "unknown",
  "temperature": null,
  "attempt": 1,
  "generation_duration_ms": 16010,
  "repair_turns": 0
}
