{
  "schema": "rsscript.eval.candidate.v1",
  "task_id": "async-stream-consume",
  "source": "async-stream-consume/candidate.rss",
  "mode": "prompt_only",
  "model": "sonnet",
  "model_version": "unknown",
  "temperature": null,
  "attempt": 1,
  "generation_duration_ms": 53875,
  "repair_turns": 0
}
