{
  "schema": "rsscript.eval.candidate.v1",
  "task_id": "callback-helper-twice",
  "source": "callback-helper-twice/candidate.rss",
  "mode": "language_card",
  "model": "sonnet",
  "model_version": "unknown",
  "temperature": null,
  "attempt": 1,
  "generation_duration_ms": 15123,
  "repair_turns": 0
}
