{
  "schema": "rsscript.eval.candidate.v1",
  "task_id": "json-array-field-total",
  "source": "json-array-field-total/candidate.rss",
  "mode": "repair_loop",
  "model": "sonnet",
  "model_version": "unknown",
  "temperature": null,
  "attempt": 1,
  "generation_duration_ms": 9985,
  "repair_turns": 0
}
