{
  "schema": "rsscript.eval.candidate.v1",
  "task_id": "two-host-ordered-calls",
  "source": "two-host-ordered-calls/candidate.rss",
  "mode": "language_card",
  "model": "sonnet",
  "model_version": "unknown",
  "temperature": null,
  "attempt": 1,
  "generation_duration_ms": 11454,
  "repair_turns": 0
}
