{
  "schema": "rsscript.eval.candidate.v1",
  "task_id": "noescape-filter-callback",
  "source": "noescape-filter-callback/candidate.rss",
  "mode": "language_card",
  "model": "sonnet",
  "model_version": "unknown",
  "temperature": null,
  "attempt": 1,
  "generation_duration_ms": 19096,
  "repair_turns": 0
}
