{
  "schema": "rsscript.eval.candidate.v1",
  "task_id": "session-with-cleanup",
  "source": "session-with-cleanup/candidate.rss",
  "mode": "prompt_only",
  "model": "sonnet",
  "model_version": "unknown",
  "temperature": null,
  "attempt": 1,
  "generation_duration_ms": 20577,
  "repair_turns": 0
}
