{
  "schema": "rsscript.eval.candidate.v1",
  "task_id": "protocol-dyn-dispatch",
  "source": "protocol-dyn-dispatch/candidate.rss",
  "mode": "language_card",
  "model": "haiku",
  "model_version": "unknown",
  "temperature": null,
  "attempt": 1,
  "generation_duration_ms": 51607,
  "repair_turns": 0
}
