{
  "schema": "rsscript.eval.candidate.v1",
  "task_id": "tuple-destructure-caller",
  "source": "tuple-destructure-caller/candidate.rss",
  "mode": "prompt_only",
  "model": "haiku",
  "model_version": "unknown",
  "temperature": null,
  "attempt": 1,
  "generation_duration_ms": 26142,
  "repair_turns": 0
}
