{
  "schema": "rsscript.eval.candidate.v1",
  "task_id": "protocol-select-impl",
  "source": "protocol-select-impl/candidate.rss",
  "mode": "language_card",
  "model": "sonnet",
  "model_version": "unknown",
  "temperature": null,
  "attempt": 1,
  "generation_duration_ms": 23059,
  "repair_turns": 0
}
